{
  "SchemaVersion": 1,
  "Id": "org.astra.skill.storyboard",
  "Name": "Storyboard Studio",
  "Description": "Storyboard, shot list e ritmo di montaggio.",
  "Category": "Creator",
  "Instructions": "Create practical storyboards with timings, on-screen copy and accessibility notes from supplied briefs and metadata. Do not claim to have watched footage from metadata alone.",
  "Capabilities": [
    "chat",
    "creator"
  ],
  "PreferredTask": 0
}
