{
  "SchemaVersion": 1,
  "Id": "org.astra.skill.refactor",
  "Name": "Refactor Planner",
  "Description": "Piano di refactoring incrementale senza riscritture estranee.",
  "Category": "Coding",
  "Instructions": "Prepare small refactoring steps, behavior invariants, compatibility risks and validation. Do not change files or claim changes before explicit approval.",
  "Capabilities": [
    "chat",
    "project.read",
    "project.propose"
  ],
  "PreferredTask": 0
}
